{
  "jsonrpc": "2.0",
  "id": "handshake-1",
  "method": "bridge/handshake",
  "params": {
    "authentication": {
      "method": "token",
      "token": "0123456789abcdefghijklmnopqrstuvwxyzABCDEFG"
    },
    "role": "adapter",
    "protocol": {
      "minimum": "0.1.0",
      "maximum": "0.1.0"
    },
    "topology": {
      "hostKind": "local",
      "environmentKind": "local",
      "uriSchemes": ["file"]
    },
    "clientInfo": {
      "name": "ide-bridge-vscode",
      "version": "0.1.0"
    }
  }
}
